{
  "razao_social": "Beta Distribuidora de Materiais LTDA",
  "cnpj": "23.456.789/0001-12",
  "porte": "Médio Porte",
  "ramo": "Comércio atacadista de materiais de construção",
  "capital_social": "750000.00",
  "municipio_matriz": "Campinas",
  "uf": "SP",
  "endereco": "Av. das Indústrias, 2450 - Campinas/SP",

  "telefone_google": "(19) 4002-8922",
  "telefone_matriz": "(19) 3322-7788",
  "email": "contato@betadistribuidora.com.br",
  "website": "https://www.betadistribuidora.com.br",

  "horario_funcionamento": {
    "segunda_sexta": "08:00-18:00",
    "sabado": "08:00-13:00",
    "domingo": ""
  },

  "ranking_google": 4.6,
  "socio_nome": [
    "Carlos Mendes",
    "Fernanda Oliveira"
  ],

  "data_abertura": "2010-03-15",
  "situacao": "ATIVA",
  "nome_fantasia": "Beta Materiais",
  "natureza_juridica": "Sociedade Empresária Limitada",

  "presenca_digital": {
    "redes_sociais": [
      "Instagram",
      "Facebook"
    ],
    "publicacoes_recorrentes": true,
    "interacao_usuarios": true
  },

  "potencial_IA": "alto",
  "resumo_analise": "Empresa com forte aderência ao setor de construção civil, presença digital ativa e histórico operacional consolidado.",

  "overall_score": 87,
  "bucket": "quente",

  "signals_positive": [
    "CNPJ ativo e regular",
    "Segmento alinhado ao setor de construção civil",
    "Website ativo com informações institucionais",
    "Boa avaliação no Google Maps",
    "Presença ativa em redes sociais"
  ],

  "signals_negative": [
    "Capital social moderado comparado a grandes distribuidores"
  ],

  "missing_fields": [],

  "confidence": 0.93,
  "potencial_comercial": "alto",
  "potencial_digital": "alto",

  "rationale": "Lead apresenta maturidade operacional, reputação online positiva e forte compatibilidade com o segmento de materiais de construção, indicando alto potencial de conversão.",

  "next_actions": [
    "Contato telefônico inicial para qualificação comercial",
    "Envio de apresentação institucional",
    "Agendamento de reunião com representante comercial"
  ]
}